Lokasi Dialog,Nama Dialog,Nama Karakter,Avatar Karakter,Kalimat 1,Kalimat 2,Kalimat 3,Kalimat 4
Kamar,Tempat Tidur,Tempat Tidur,,Sebuah tempat tidur biru yang di tata rapi.,,,
Kamar,Meja Belajar,Meja Belajar,,Sebuah Meja Belajar Lengkap dengan berbagai macam buku dan Sebuah Komputer.,Ingin Belajar Apa?,,
Kamar,Lemari,Lemari,,sebuah lemari pakaian tua tempat kamu menyimpan baju,,,
Kamar,Kloset,Kloset,,sebuah ruangan kecil untuk menyimpan barang-barang lama.,,,
Lorong Rumah,Pintu,Pintu Gudang,,(terkunci),,,
Lorong Rumah,Bunga,Bunga,,tanaman bunga yang tumbuh subur.... Baunya harum,,,
Lorong Rumah,Foto Kucing,Foto,,Foto Kucing Peliharaanmu,,,
Ruang Tamu,Lampu,,,Ini adalah lampu,,,
Ruang Tamu,Meja Ruang tamu,,,"meja ruang tamu, tamu yang datang biasanya mencari ayah",,,
Ruang Tamu,Televisi,,,"Iklan mi instan sedang ditayangkan, malah jadi lapar nih",,,
Ruang Tamu,foto keluarga,Foto Keluarga,,"fotomu bersama ayah, ibu dan adikmu terpajang di rak. ",,,
Ruang Tamu,karpet,,,"badanku pegal - pegal dan banyak pikiran, apa aku harus melakukan agar mengurangi beban pikiranku",,,
Ruang Tamu,Ayah,Ayah,,"[player], bagaimana harimu di sekolah?",,,
Dapur,Ibu,Ibu,,"[player], bagaimana nilaimu di sekolah? Teruslah belajar dan tingkatkan prestasimu",,,
Dapur,Meja Makan,Meja Makan,,ada dua buah roti di atas meja,,,
Dapur,Tempat Cuci Piring,Kabinet Dapur,,"kabinet dapur ini memiliki wastafel unntuk mencuci piiiring, sebuah mikrowave, lemari tempat menyimpan bumbu dan peralatan dapur, serta sebuah rak di atasnya",,,
Dapur,Kulkas,Kulkas,,"bebrapa bahan makanan di kulkas sepertinya akan habis, mungkin ibu akan ke pasar untuk membelinya.",,,
Depan Rumah,Ibu,Ibu,,lihat kebun ibu sangat subur kan :) ,,,
Depan Rumah,Tanda Kebun,Tanda,,“Kebun Ibu”,,,
Perumahan,Budi,Budi,,"hai [player] hari ini cuacanya sangat bagus, apa kau ingin jalan-jalan dengan ku atau mengobrol disini?",,,
Perumahan,Julia,,,"hai [player] hari ini cuacanya sangat bagus, apa kau ingin jalan-jalan dengan ku atau mengobrol disini?",,,
Perumahan,Tanda Rumah Biru,Tanda,,“Rumah Budi”,,,
Perumahan,Tanda Rumah Kuning,Tanda,,“Rumah Julia”,,,
Perumahan,Tanda Rumah Pink,Tanda,,“Rumah bu Rahmi”,,,
Perumahan,Tanda Rumah Merah,Tanda,,“Rumah pak Rio”,,,
Perumahan,Pintu Rumah Biru,Rumah Budi,,"terkunci, munkin budi tidak ada di rumah",,,
Perumahan,Pintu Rumah Kuning,Rumah Julia,,"terkunci, munkin julia tidak ada di rumah",,,
Perumahan,Pintu Rumah Pink,Rumah bu Rahmi,,"terkunci, munkin bu rahmi tidak ada di rumah",,,
Perumahan,Pintu Rumah Merah,Rumah pak Rio,,"terkunci, munkin pak rio tidak ada di rumah",,,
Depan Sekolah,Npc Figuran Cowok,Adik Kelas,,Hallo,,,
Depan Sekolah,Npc Figuran Cewek,Adik Kelas,,Hai,,,
Depan Sekolah,Sekolah Tutup,Sekloah,,Pintu sekolah terkunci.,Kamu menyadari kalau ini sudah malam,Tentu saja sekolah tutup,
Lorong Sekolah Lt 1,Tanda Pintu Kantin,Tanda,,“Kantin”,,,
Kantin,Ibu Kantin,Ibu Kantin,,mau beli apa dek?,,,
Kantin,Display Jajan,Display Jajan,,"jajanan didalam sini terlihat sangat enak, jadi ingin beli 1",,,
Kantin,Kulkas,Kulkas Kantin,,"munuman didalam kulkas terlihat segar, jadi ingin beli 1",,,
Kantin,Meja Kantin,Meja Kantin,,Meja ini sepertinya tidak ditempati,,,
Kantin,Npc Figuran Cewek,Adik Kelas,,"Pilihan jajan disini banyak, kesukanku rotinya",,,
Kantin,Npc Figuran Cowok,Adik Kelas,,Much much much. (sepertinya sibuk makan),,,
Lorong Sekolah Lt 2,Tanda Pintu Kelas,Tanda,,“Ruang Kelas”,,,
Lorong Sekolah Lt 3,Loker,Loker,,(kamu mengecek lokermu dan menguncinya kembali),,,
Kelas,Budi,Budi,,hai [player] apa kau sudah mengerjakan PR?,,,
Kelas,Julia,,,"hai [player] duduklah di bangkumu, sebentar lagi bel sekolah berbunyi",,,
Kelas,Papan Tulis,Papan Tulis,,papan tulis terlihat bersih.,sepertinya petugas piket sudah membersihkannya,,
Kelas,Meja Guru,Meja Guru,,kamu menyadari bahwa meja guru lebih besar dibandingkan meja siswa,,,
Kelas,Meja Kiri Atas (Meja Julia),Meja Siswa,,Maja Ini ditempat Julia,,,
Kelas,Meja Tengah Atas (Mejamu),Meja Siswa,,Meja ini adalah mejamu,,,
Kelas,Meja Kanan Atas (Meja Budi),Meja Siswa,,Meja Ini ditempati Budi,,,
Kelas,Meja Kiri Bawah,Meja Siswa,,Meja murid lain.,,,
Kelas,Meja Tengah Bawah,Meja Siswa,,Meja murid lain.,,,
Kelas,Meja Kanan Bawah,Meja Siswa,,Meja murid lain.,,,
Kelas,Mulai Kelas,Meja Siswa,,Kelas Masih Belum Di Mulai.,Tunggu Hingga Kelas Di Mulai?,,
Kelas,Masuk Kelas,Kelas,,Sepertinya Kelas Sudah Di Mulai,Masuk Kelas?,,
Lorong Sekolah Lt 2 Bagian 2,Tanda Pintu Kanan,Tanda,,“Ruang Kepala Sekolah”,,,
Lorong Sekolah Lt 2 Bagian 2,Pintu Ruang Kanan,Tanda,,Kamu tidak memiliki alasan untuk bertemu kepala sekolah,,,
Lorong Sekolah Lt 2 Bagian 2,Tanda Pintu Ruang Guru,,,“Ruang Guru”,,,
Ruang Guru,Sofa ,Sofa,,Sepertinya digunakan saat ada tamu,,,
Ruang Guru,Komputer Pak Rio,Komputer,,Sepertinya ini komputer Pak Rio,ada aplikasi yang sedang terbuka. Mungkin pekerjaan sekolah.,lebih baik tidak kamu sentuh.,
Ruang Guru,Rak Buku,Rak Buku,,Rak ini berisi daftar absen dan dokumen-dokumen sekolah lainnya.,sebaiknya tidak kamu lihat tanpa izin,,
Ruang Guru,Pak Rio,,,"hai [player] bagaimana harimu, apa kau berteman baik dengan teman sekelasmu?",,,
Ruang Guru,Bu Rahmi,,,oh hai [player] bagaimana harimu?,,,
Lorong Sekolah Lt 3,Tanda,,,Sepertinya pintu ini menuju atap sekolah,Pintunya Terkunci.,,
Lorong Sekolah Lt 3,Pintu Atap,,,"pintu ini menuju atap sekolah dengan pemandangan yang bagus, ",(Kamu mencoba membukaya),yah ... pintunya terkunci :(,
